{
  "opportunity_id": "OPP-PPL-BOC-B4",
  "source": "library-report:BABY OLDER CHILDREN.md",
  "source_references": [
    "Product Pipeline/Postpartum Library/BABY OLDER CHILDREN.md",
    "Product Pipeline/followup.md"
  ],
  "life_area": "m01",
  "focus_market": "BABY OLDER CHILDREN",
  "submarket": "NEWBORN + MULTIPLE CHILDREN",
  "collected_at": "2026-08-19",
  "finding": {
    "headline": "\"The Extracurriculars Collapsed\"",
    "problem": "\"He missed 3 Saturday matches. His coach noticed. I promised I'd manage and I can't. My son thinks I chose the baby over him.\"",
    "recurring_situation": "NEWBORN + MULTIPLE CHILDREN",
    "person": "Mum who dropped her 8-year-old's football/ballet because of the newborn; child embarrassed, husband annoyed.",
    "trigger": "",
    "failed_attempt": "",
    "emotional_stake": "",
    "desired_outcome": "",
    "evidence_quotes": [],
    "mechanism_hypotheses": [],
    "competition_notes": "See RESEARCH BASE section of source report."
  },
  "survival_pain_test": {
    "urgency": false,
    "embarrassment": false,
    "failed_attempts": false,
    "identity_threat": false,
    "immediate_spend": false,
    "signals_observed": [
      "verdict: PASSES (4/5)"
    ]
  },
  "disposition": {
    "library_role": "STANDALONE_TRANSFORMATION",
    "rationale": "Report assigns: \"Standalone product (keeping older-child routines alive) — or Module inside B-series bundle\". Verdict: PASSES (4/5).",
    "assigned_at": "2026-08-19",
    "promoted_transformation_id": null,
    "reclassification_history": []
  },
  "status": "dispositioned",
  "related_opportunity_ids": []
}
