{
  "opportunity_id": "OPP-PPL-PPC-E2",
  "source": "library-report:POSTPARTUM PERSONAL CARE.md",
  "source_references": [
    "Product Pipeline/Postpartum Library/POSTPARTUM PERSONAL CARE.md",
    "Product Pipeline/followup.md"
  ],
  "life_area": "m01",
  "focus_market": "POSTPARTUM PERSONAL CARE",
  "submarket": "ALONE TIME & IDENTITY RECOVERY",
  "collected_at": "2026-08-19",
  "finding": {
    "headline": "\"The Guilty-Nail-Salon Mum\"",
    "problem": "\"The only time I feel like me is at the salon. But leaving her makes me a 'bad mother' in my head.\"",
    "recurring_situation": "ALONE TIME & IDENTITY RECOVERY",
    "person": "30-yr-old mum, one treat she allows is getting nails done, but feels guilty leaving baby 90 min.",
    "trigger": "",
    "failed_attempt": "",
    "emotional_stake": "",
    "desired_outcome": "",
    "evidence_quotes": [],
    "mechanism_hypotheses": [],
    "competition_notes": "See RESEARCH BASE section of source report."
  },
  "survival_pain_test": {
    "urgency": false,
    "embarrassment": false,
    "failed_attempts": false,
    "identity_threat": false,
    "immediate_spend": false,
    "signals_observed": [
      "verdict: PASSES (3/5) —"
    ]
  },
  "disposition": {
    "library_role": "MARKETING_ANGLE",
    "rationale": "Report assigns: \"Marketing angle / Bundle component (permission + self-care)\". Verdict: PASSES (3/5) —.",
    "assigned_at": "2026-08-19",
    "promoted_transformation_id": null,
    "reclassification_history": []
  },
  "status": "dispositioned",
  "related_opportunity_ids": []
}
