{
  "opportunity_id": "OPP-PPL-PHM-A4",
  "source": "library-report:POSTPARTUM HOUSEHOLD MANAGEMENT.md",
  "source_references": [
    "Product Pipeline/Postpartum Library/POSTPARTUM HOUSEHOLD MANAGEMENT.md",
    "Product Pipeline/followup.md"
  ],
  "life_area": "m01",
  "focus_market": "POSTPARTUM HOUSEHOLD MANAGEMENT",
  "submarket": "HIDDEN MARKET — Running a household when one adult is recovering and BOTH are exhausted",
  "collected_at": "2026-08-19",
  "finding": {
    "headline": "\"Grocery-on-Autopilot\" (Naija Market Edition)",
    "problem": "\"My husband comes back with rice but forgets tomatoes and baby wipes. I'm stuck eating garri because I can't Shop.\"",
    "recurring_situation": "HIDDEN MARKET — Running a household when one adult is recovering and BOTH are exhausted",
    "person": "Mum who can't get to market; partner buys wrong things; needs a repeatable list + delivery instructions.",
    "trigger": "",
    "failed_attempt": "",
    "emotional_stake": "",
    "desired_outcome": "",
    "evidence_quotes": [],
    "mechanism_hypotheses": [],
    "competition_notes": "See RESEARCH BASE section of source report."
  },
  "survival_pain_test": {
    "urgency": false,
    "embarrassment": false,
    "failed_attempts": false,
    "identity_threat": false,
    "immediate_spend": false,
    "signals_observed": [
      "verdict: PASSES | LIBRARY ROLE: Bonus / Module"
    ]
  },
  "disposition": {
    "library_role": "MODULE",
    "rationale": "Report assigns: \"Bonus / Module\". Verdict: PASSES | LIBRARY ROLE: Bonus / Module.",
    "assigned_at": "2026-08-19",
    "promoted_transformation_id": null,
    "reclassification_history": []
  },
  "status": "dispositioned",
  "related_opportunity_ids": []
}
