{
  "opportunity_id": "OPP-PPL-NPA-N6",
  "source": "library-report:NEW-PARENT ADMINISTRATION MARKET.md",
  "source_references": [
    "Product Pipeline/Postpartum Library/NEW-PARENT ADMINISTRATION MARKET.md",
    "Product Pipeline/followup.md"
  ],
  "life_area": "m01",
  "focus_market": "NEW-PARENT ADMINISTRATION MARKET",
  "submarket": "unassigned",
  "collected_at": "2026-08-19",
  "finding": {
    "headline": "\"Adding Newborn to NHIS/HMO Before the Window Closes\"",
    "problem": "\"The hospital knows the baby exists, so surely insurance does too? Then the bill came. I didn't know I had to enrol him myself.\"",
    "recurring_situation": "unassigned",
    "person": "Nigerian mum on an HMO/NHIS whose baby needs the 6-week pediatric visits + vaccines covered, but she doesn't know she must formally add the newborn or face out-of-pocket.",
    "trigger": "",
    "failed_attempt": "",
    "emotional_stake": "",
    "desired_outcome": "",
    "evidence_quotes": [],
    "mechanism_hypotheses": [],
    "competition_notes": "See RESEARCH BASE section of source report."
  },
  "survival_pain_test": {
    "urgency": false,
    "embarrassment": false,
    "failed_attempts": false,
    "identity_threat": false,
    "immediate_spend": true,
    "signals_observed": [
      "IMMEDIATE SPEND scored 4/5 (>=3 = YES)"
    ]
  },
  "disposition": {
    "library_role": "STANDALONE_TRANSFORMATION",
    "rationale": "Report assigns: \"Standalone product (NHIS/HMO newborn enrolment guide) + Module.\". Verdict: PASSES.",
    "assigned_at": "2026-08-19",
    "promoted_transformation_id": null,
    "reclassification_history": []
  },
  "status": "dispositioned",
  "related_opportunity_ids": []
}
