{
  "opportunity_id": "OPP-PPL-BOC-C8",
  "source": "library-report:BABY OLDER CHILDREN.md",
  "source_references": [
    "Product Pipeline/Postpartum Library/BABY OLDER CHILDREN.md",
    "Product Pipeline/followup.md"
  ],
  "life_area": "m01",
  "focus_market": "BABY OLDER CHILDREN",
  "submarket": "NEWBORN + MULTIPLE CHILDREN",
  "collected_at": "2026-08-19",
  "finding": {
    "headline": "\"Sick Older Child + Newborn at Risk\"",
    "problem": "\"My son has catarrh and keeps kissing the baby. What if she gets it? I'm disinfecting everything and losing my mind.\"",
    "recurring_situation": "NEWBORN + MULTIPLE CHILDREN",
    "person": "Mum whose toddler/school kid brings home germs; she's terrified of newborn falling ill; isolation impossible.",
    "trigger": "",
    "failed_attempt": "",
    "emotional_stake": "",
    "desired_outcome": "",
    "evidence_quotes": [],
    "mechanism_hypotheses": [],
    "competition_notes": "See RESEARCH BASE section of source report."
  },
  "survival_pain_test": {
    "urgency": false,
    "embarrassment": false,
    "failed_attempts": false,
    "identity_threat": false,
    "immediate_spend": false,
    "signals_observed": [
      "verdict: PASSES (4/5)"
    ]
  },
  "disposition": {
    "library_role": "STANDALONE_TRANSFORMATION",
    "rationale": "Report assigns: \"Standalone product (germ-management & newborn protection) — seasonal/urgent\". Verdict: PASSES (4/5).",
    "assigned_at": "2026-08-19",
    "promoted_transformation_id": null,
    "reclassification_history": []
  },
  "status": "dispositioned",
  "related_opportunity_ids": []
}
