{
  "opportunity_id": "OPP-PPL-MPB-22",
  "source": "library-report:MONEY POST-BABY HOUSEHOLD MANAGEMENT.md",
  "source_references": [
    "Product Pipeline/Postpartum Library/MONEY POST-BABY HOUSEHOLD MANAGEMENT.md",
    "Product Pipeline/followup.md"
  ],
  "life_area": "m01",
  "focus_market": "MONEY POST-BABY HOUSEHOLD MANAGEMENT",
  "submarket": "HIDDEN MARKETS",
  "collected_at": "2026-08-19",
  "finding": {
    "headline": "\"The ₦10,000/month automated baby fund\" (irregular income)",
    "problem": "\"My income is ₦50k one month, ₦300k next — I can't budget like a salary person.\"",
    "recurring_situation": "HIDDEN MARKETS",
    "person": "Freelancer/trader mum with volatile cash [S5][S6].",
    "trigger": "",
    "failed_attempt": "",
    "emotional_stake": "",
    "desired_outcome": "",
    "evidence_quotes": [],
    "mechanism_hypotheses": [],
    "competition_notes": "See RESEARCH BASE section of source report."
  },
  "survival_pain_test": {
    "urgency": false,
    "embarrassment": false,
    "failed_attempts": false,
    "identity_threat": false,
    "immediate_spend": false,
    "signals_observed": [
      "verdict: PASSES"
    ]
  },
  "disposition": {
    "library_role": "STANDALONE_TRANSFORMATION",
    "rationale": "Report assigns: \"Standalone / Module in Niche 21.\". Verdict: PASSES.",
    "assigned_at": "2026-08-19",
    "promoted_transformation_id": null,
    "reclassification_history": []
  },
  "status": "dispositioned",
  "related_opportunity_ids": []
}
