{
  "opportunity_id": "OPP-PPL-MPB-1",
  "source": "library-report:MONEY POST-BABY HOUSEHOLD MANAGEMENT.md",
  "source_references": [
    "Product Pipeline/Postpartum Library/MONEY POST-BABY HOUSEHOLD MANAGEMENT.md",
    "Product Pipeline/followup.md"
  ],
  "life_area": "m01",
  "focus_market": "MONEY POST-BABY HOUSEHOLD MANAGEMENT",
  "submarket": "HIDDEN MARKETS",
  "collected_at": "2026-08-19",
  "finding": {
    "headline": "\"The ₦5,000-a-week diaper squeeze\"",
    "problem": "\"Every week ₦5,000 disappears on diapers and I'm hiding it from my husband because I feel like a bad mother for not managing.\"",
    "recurring_situation": "HIDDEN MARKETS",
    "person": "Lagos first-time mum, 4 weeks postpartum, husband's income just dipped, baby in size-3 diapers.",
    "trigger": "",
    "failed_attempt": "",
    "emotional_stake": "",
    "desired_outcome": "",
    "evidence_quotes": [],
    "mechanism_hypotheses": [],
    "competition_notes": "See RESEARCH BASE section of source report."
  },
  "survival_pain_test": {
    "urgency": false,
    "embarrassment": false,
    "failed_attempts": false,
    "identity_threat": false,
    "immediate_spend": false,
    "signals_observed": [
      "verdict: PASSES"
    ]
  },
  "disposition": {
    "library_role": "STANDALONE_TRANSFORMATION",
    "rationale": "Report assigns: \"Standalone (also cross-sells formula niche).\". Verdict: PASSES.",
    "assigned_at": "2026-08-19",
    "promoted_transformation_id": null,
    "reclassification_history": []
  },
  "status": "dispositioned",
  "related_opportunity_ids": []
}
