{
  "opportunity_id": "OPP-PPL-NPO-N22",
  "source": "library-report:NEW PARENT OPERATING SYSTEM.md",
  "source_references": [
    "Product Pipeline/Postpartum Library/NEW PARENT OPERATING SYSTEM.md",
    "Product Pipeline/followup.md"
  ],
  "life_area": "m01",
  "focus_market": "NEW PARENT OPERATING SYSTEM",
  "submarket": "First-year household financial transition (N22)",
  "collected_at": "2026-08-19",
  "finding": {
    "headline": "\"The First-Year Money Map\"",
    "problem": "\"The bills are terrifying. Delivery, nappies, formula — I didn't know a baby costs $20k+ the first year (BabyCenter). I lie awake about money.\"",
    "recurring_situation": "First-year household financial transition (N22)",
    "person": "33-yr-old couple, baby 1 month, one income dropped (maternity leave), shocked by nappy/delivery costs, no budget.",
    "trigger": "",
    "failed_attempt": "",
    "emotional_stake": "",
    "desired_outcome": "",
    "evidence_quotes": [],
    "mechanism_hypotheses": [],
    "competition_notes": "See RESEARCH BASE section of source report."
  },
  "survival_pain_test": {
    "urgency": false,
    "embarrassment": false,
    "failed_attempts": false,
    "identity_threat": false,
    "immediate_spend": false,
    "signals_observed": [
      "verdict: PASSES (5/5)"
    ]
  },
  "disposition": {
    "library_role": "STANDALONE_TRANSFORMATION",
    "rationale": "Report assigns: \"Standalone (pairs with N6/N10).\". Verdict: PASSES (5/5).",
    "assigned_at": "2026-08-19",
    "promoted_transformation_id": null,
    "reclassification_history": []
  },
  "status": "dispositioned",
  "related_opportunity_ids": []
}
