{
  "opportunity_id": "OPP-PPL-RTW-A3",
  "source": "library-report:RETURN TO WORK.md",
  "source_references": [
    "Product Pipeline/Postpartum Library/RETURN TO WORK.md",
    "Product Pipeline/followup.md"
  ],
  "life_area": "m01",
  "focus_market": "RETURN TO WORK",
  "submarket": "HIDDEN MARKET — THE 30 DAYS BEFORE & AFTER RETURNING TO WORK",
  "collected_at": "2026-08-19",
  "finding": {
    "headline": "\"The Strong-Woman Silence (omugwo hangover)\"",
    "problem": "\"My mum/mother-in-law would say 'we did it, stop crying.' I can't say I'm scared. It feels like betrayal.\"",
    "recurring_situation": "HIDDEN MARKET — THE 30 DAYS BEFORE & AFTER RETURNING TO WORK",
    "person": "Nigerian new mum whose omugwo has ended; taught by culture to never complain; now silently terrified of return.",
    "trigger": "",
    "failed_attempt": "",
    "emotional_stake": "",
    "desired_outcome": "",
    "evidence_quotes": [],
    "mechanism_hypotheses": [],
    "competition_notes": "See RESEARCH BASE section of source report."
  },
  "survival_pain_test": {
    "urgency": false,
    "embarrassment": false,
    "failed_attempts": false,
    "identity_threat": false,
    "immediate_spend": false,
    "signals_observed": [
      "verdict: PASSES (5/5)"
    ]
  },
  "disposition": {
    "library_role": "MODULE",
    "rationale": "Report assigns: \"Module / angle inside A1.\". Verdict: PASSES (5/5).",
    "assigned_at": "2026-08-19",
    "promoted_transformation_id": null,
    "reclassification_history": []
  },
  "status": "dispositioned",
  "related_opportunity_ids": []
}
