{
  "opportunity_id": "OPP-PPL-MPB-27",
  "source": "library-report:MONEY POST-BABY HOUSEHOLD MANAGEMENT.md",
  "source_references": [
    "Product Pipeline/Postpartum Library/MONEY POST-BABY HOUSEHOLD MANAGEMENT.md",
    "Product Pipeline/followup.md"
  ],
  "life_area": "m01",
  "focus_market": "MONEY POST-BABY HOUSEHOLD MANAGEMENT",
  "submarket": "HIDDEN MARKETS",
  "collected_at": "2026-08-19",
  "finding": {
    "headline": "\"The bill no one sees: money + pressure plan for the Nigerian new father\"",
    "problem": "\"I'm supposed to be the rock but I have ₦12k and everyone expects me to provide.\"",
    "recurring_situation": "HIDDEN MARKETS",
    "person": "New dad facing birth + visitor + ceremony costs, some \"disappear\" [S12].",
    "trigger": "",
    "failed_attempt": "",
    "emotional_stake": "",
    "desired_outcome": "",
    "evidence_quotes": [],
    "mechanism_hypotheses": [],
    "competition_notes": "See RESEARCH BASE section of source report."
  },
  "survival_pain_test": {
    "urgency": false,
    "embarrassment": false,
    "failed_attempts": false,
    "identity_threat": false,
    "immediate_spend": false,
    "signals_observed": [
      "verdict: PASSES (STRONG)"
    ]
  },
  "disposition": {
    "library_role": "STANDALONE_TRANSFORMATION",
    "rationale": "Report assigns: \"Standalone (underserved male audience).\". Verdict: PASSES (STRONG).",
    "assigned_at": "2026-08-19",
    "promoted_transformation_id": null,
    "reclassification_history": []
  },
  "status": "dispositioned",
  "related_opportunity_ids": []
}
