{
  "opportunity_id": "OPP-PPL-CSS-A5",
  "source": "library-report:C-SECTION RECOVERY.md",
  "source_references": [
    "Product Pipeline/Postpartum Library/C-SECTION RECOVERY.md",
    "Product Pipeline/followup.md"
  ],
  "life_area": "m01",
  "focus_market": "C-SECTION RECOVERY",
  "submarket": "HIDDEN MARKET — \"How do I function normally again after a C-section while caring for a newborn?\"",
  "collected_at": "2026-08-19",
  "finding": {
    "headline": "\"The Shuffling Grandma (mobility shame in community)\"",
    "problem": "\"Aunties came to visit and I couldn't even stand to welcome them properly. I felt like they were judging me for not 'getting up like a real woman.'\"",
    "recurring_situation": "HIDDEN MARKET — \"How do I function normally again after a C-section while caring for a newborn?\"",
    "person": "A 26-yr-old Igbo mom at 1 week post-CS, visitors arrive to \"greet the new mother\"; she can barely stand to receive them and fears they'll think she's weak/lazy.",
    "trigger": "",
    "failed_attempt": "",
    "emotional_stake": "",
    "desired_outcome": "",
    "evidence_quotes": [],
    "mechanism_hypotheses": [],
    "competition_notes": "See RESEARCH BASE section of source report."
  },
  "survival_pain_test": {
    "urgency": false,
    "embarrassment": false,
    "failed_attempts": false,
    "identity_threat": false,
    "immediate_spend": false,
    "signals_observed": [
      "verdict: PASSES (4/5)"
    ]
  },
  "disposition": {
    "library_role": "MARKETING_ANGLE",
    "rationale": "Report assigns: \"Marketing angle / entry point (shame → reassurance) for A1.\". Verdict: PASSES (4/5).",
    "assigned_at": "2026-08-19",
    "promoted_transformation_id": null,
    "reclassification_history": []
  },
  "status": "dispositioned",
  "related_opportunity_ids": []
}
