{
  "opportunity_id": "OPP-PPL-NPA-N23",
  "source": "library-report:NEW-PARENT ADMINISTRATION MARKET.md",
  "source_references": [
    "Product Pipeline/Postpartum Library/NEW-PARENT ADMINISTRATION MARKET.md",
    "Product Pipeline/followup.md"
  ],
  "life_area": "m01",
  "focus_market": "NEW-PARENT ADMINISTRATION MARKET",
  "submarket": "unassigned",
  "collected_at": "2026-08-19",
  "finding": {
    "headline": "\"First Immunization / First Paediatrician Prep Sheet\"",
    "problem": "\"First shots are next week. What do I bring? What if he gets a fever — is that normal? I have a hundred questions.\"",
    "recurring_situation": "unassigned",
    "person": "First-time mum preparing for baby's first weight-check / first vaccine who needs a one-page \"what to bring + questions to ask\" (culturally: fever-after-vaccine fears).",
    "trigger": "",
    "failed_attempt": "",
    "emotional_stake": "",
    "desired_outcome": "",
    "evidence_quotes": [],
    "mechanism_hypotheses": [],
    "competition_notes": "See RESEARCH BASE section of source report."
  },
  "survival_pain_test": {
    "urgency": false,
    "embarrassment": false,
    "failed_attempts": false,
    "identity_threat": false,
    "immediate_spend": true,
    "signals_observed": [
      "IMMEDIATE SPEND scored 8/5 (>=3 = YES)"
    ]
  },
  "disposition": {
    "library_role": "MODULE",
    "rationale": "Report assigns: \"Bonus / Module (First-Visit Prep).\". Verdict: PASSES (marginal).",
    "assigned_at": "2026-08-19",
    "promoted_transformation_id": null,
    "reclassification_history": []
  },
  "status": "dispositioned",
  "related_opportunity_ids": []
}
