{
  "opportunity_id": "OPP-PPL-NSL-20",
  "source": "library-report:NEW-PARENT SOCIAL LIFE.md",
  "source_references": [
    "Product Pipeline/Postpartum Library/NEW-PARENT SOCIAL LIFE.md",
    "Product Pipeline/followup.md"
  ],
  "life_area": "m01",
  "focus_market": "NEW-PARENT SOCIAL LIFE",
  "submarket": "unassigned",
  "collected_at": "2026-08-19",
  "finding": {
    "headline": "\"The Four-Walls Prison\"",
    "problem": "\"I love my baby but I'm suffocating in this flat. I want to walk to the end of the road and I can't make my feet move. I feel like a prisoner in my own home.\"",
    "recurring_situation": "unassigned",
    "person": "Mum with severe cabin fever whose anxiety (not laziness) keeps her inside; every attempt to leave ends in panic.",
    "trigger": "",
    "failed_attempt": "",
    "emotional_stake": "",
    "desired_outcome": "",
    "evidence_quotes": [],
    "mechanism_hypotheses": [],
    "competition_notes": "See RESEARCH BASE section of source report."
  },
  "survival_pain_test": {
    "urgency": false,
    "embarrassment": false,
    "failed_attempts": false,
    "identity_threat": false,
    "immediate_spend": false,
    "signals_observed": [
      "verdict: PASSES"
    ]
  },
  "disposition": {
    "library_role": "STANDALONE_TRANSFORMATION",
    "rationale": "Report assigns: \"Standalone — \"The Front-Door Protocol: A 7-Day Escape From Cabin Fever (Baby in Tow).\"\". Verdict: PASSES.",
    "assigned_at": "2026-08-19",
    "promoted_transformation_id": null,
    "reclassification_history": []
  },
  "status": "dispositioned",
  "related_opportunity_ids": []
}
