{
  "opportunity_id": "OPP-PPL-SLP-A4",
  "source": "library-report:SLEEP DEPRIVATION.md",
  "source_references": [
    "Product Pipeline/Postpartum Library/SLEEP DEPRIVATION.md",
    "Product Pipeline/followup.md"
  ],
  "life_area": "m01",
  "focus_market": "SLEEP DEPRIVATION",
  "submarket": "HIDDEN MARKET — \"HOW EXHAUSTED PARENTS DIVIDE THE NIGHT\"",
  "collected_at": "2026-08-19",
  "finding": {
    "headline": "\"Bedtime Battle (fighting sleep / witching hour)\"",
    "problem": "\"From 6pm my baby turns into a different child. He cries no matter what I do. My husband says 'just put him down' but he literally fights sleep with his whole body.\"",
    "recurring_situation": "HIDDEN MARKET — \"HOW EXHAUSTED PARENTS DIVIDE THE NIGHT\"",
    "person": "33-yr-old UK-Nigerian mum, 7-week-old who arches, stiffens and screams at every bedtime; evenings (5–11pm) are dread.",
    "trigger": "",
    "failed_attempt": "",
    "emotional_stake": "",
    "desired_outcome": "",
    "evidence_quotes": [],
    "mechanism_hypotheses": [],
    "competition_notes": "See RESEARCH BASE section of source report."
  },
  "survival_pain_test": {
    "urgency": false,
    "embarrassment": false,
    "failed_attempts": false,
    "identity_threat": false,
    "immediate_spend": false,
    "signals_observed": [
      "verdict: PASSES (4/5)"
    ]
  },
  "disposition": {
    "library_role": "MODULE",
    "rationale": "Report assigns: \"Angle/Module\" | cross-sells: Bundle \"Newborn Sleep Trio\". Verdict: PASSES (4/5).",
    "assigned_at": "2026-08-19",
    "promoted_transformation_id": null,
    "reclassification_history": []
  },
  "status": "dispositioned",
  "related_opportunity_ids": []
}
