{
  "opportunity_id": "OPP-PPL-GFB-M3",
  "source": "library-report:GRANDPARENTS FAMILY BOUNDARIES.md",
  "source_references": [
    "Product Pipeline/Postpartum Library/GRANDPARENTS FAMILY BOUNDARIES.md",
    "Product Pipeline/followup.md"
  ],
  "life_area": "m01",
  "focus_market": "GRANDPARENTS FAMILY BOUNDARIES",
  "submarket": "HIDDEN MARKET (How to manage family after the baby arrives)",
  "collected_at": "2026-08-19",
  "finding": {
    "headline": "\"The Rest-Without-Guilt 'Strong Woman' Reset\"",
    "problem": "\"Resting feels like laziness. Everyone says 'we did it and didn't complain.' I'm healing but I feel guilty for sitting down.\"",
    "recurring_situation": "HIDDEN MARKET (How to manage family after the baby arrives)",
    "person": "Mum paralysed by the \"endure silently\" mandate; can't rest without shame (Naija Feminists piece).",
    "trigger": "",
    "failed_attempt": "",
    "emotional_stake": "",
    "desired_outcome": "",
    "evidence_quotes": [],
    "mechanism_hypotheses": [],
    "competition_notes": "See RESEARCH BASE section of source report."
  },
  "survival_pain_test": {
    "urgency": false,
    "embarrassment": false,
    "failed_attempts": false,
    "identity_threat": false,
    "immediate_spend": true,
    "signals_observed": [
      "IMMEDIATE SPEND scored 5/5 (>=3 = YES)"
    ]
  },
  "disposition": {
    "library_role": "STANDALONE_TRANSFORMATION",
    "rationale": "Report assigns: \"Standalone\". Verdict: PASSES · ROLE: Standalone (mindset) — pairs with H1.",
    "assigned_at": "2026-08-19",
    "promoted_transformation_id": null,
    "reclassification_history": []
  },
  "status": "dispositioned",
  "related_opportunity_ids": []
}
