{
  "opportunity_id": "OPP-PPL-GFB-G8",
  "source": "library-report:GRANDPARENTS FAMILY BOUNDARIES.md",
  "source_references": [
    "Product Pipeline/Postpartum Library/GRANDPARENTS FAMILY BOUNDARIES.md",
    "Product Pipeline/followup.md"
  ],
  "life_area": "m01",
  "focus_market": "GRANDPARENTS FAMILY BOUNDARIES",
  "submarket": "HIDDEN MARKET (How to manage family after the baby arrives)",
  "collected_at": "2026-08-19",
  "finding": {
    "headline": "\"The Competing-Grandmas Mum\"",
    "problem": "\"My mum and my MIL keep score of who held the baby more. I'm the referee of a war I didn't start.\"",
    "recurring_situation": "HIDDEN MARKET (How to manage family after the baby arrives)",
    "person": "Both maternal & paternal gran demanding \"equal\" access; mum caught in the middle.",
    "trigger": "",
    "failed_attempt": "",
    "emotional_stake": "",
    "desired_outcome": "",
    "evidence_quotes": [],
    "mechanism_hypotheses": [],
    "competition_notes": "See RESEARCH BASE section of source report."
  },
  "survival_pain_test": {
    "urgency": false,
    "embarrassment": false,
    "failed_attempts": false,
    "identity_threat": false,
    "immediate_spend": true,
    "signals_observed": [
      "IMMEDIATE SPEND scored 4/5 (>=3 = YES)"
    ]
  },
  "disposition": {
    "library_role": "MODULE",
    "rationale": "Report assigns: \"Module\". Verdict: PASSES · ROLE: Module (fair-rota).",
    "assigned_at": "2026-08-19",
    "promoted_transformation_id": null,
    "reclassification_history": []
  },
  "status": "dispositioned",
  "related_opportunity_ids": []
}
