{
  "opportunity_id": "OPP-PPL-PBR-C6",
  "source": "library-report:POSTPARTUM BODY RECOVERY.md",
  "source_references": [
    "Product Pipeline/Postpartum Library/POSTPARTUM BODY RECOVERY.md",
    "Product Pipeline/followup.md"
  ],
  "life_area": "m01",
  "focus_market": "POSTPARTUM BODY RECOVERY",
  "submarket": "HIDDEN MARKET — BODY CONFIDENCE + GETTING DRESSED AGAIN",
  "collected_at": "2026-08-19",
  "finding": {
    "headline": "\"Body Grief After Multiple Pregnancies\"",
    "problem": "\"This is my third. My body is just different forever. I grieve the woman in old photos and feel guilty for it.\"",
    "recurring_situation": "HIDDEN MARKET — BODY CONFIDENCE + GETTING DRESSED AGAIN",
    "person": "Catherine, 38, Calgary (Kenyan), 3 kids under 6; mourns pre-kids body; feels \"permanently changed,\" avoids reunions.",
    "trigger": "",
    "failed_attempt": "",
    "emotional_stake": "",
    "desired_outcome": "",
    "evidence_quotes": [],
    "mechanism_hypotheses": [],
    "competition_notes": "See RESEARCH BASE section of source report."
  },
  "survival_pain_test": {
    "urgency": true,
    "embarrassment": true,
    "failed_attempts": true,
    "identity_threat": true,
    "immediate_spend": true,
    "signals_observed": [
      "URGENCY scored 3/5 (>=3 = YES)",
      "EMBARRASSMENT scored 4/5 (>=3 = YES)",
      "FAILED ATTEMPTS scored 4/5 (>=3 = YES)",
      "IDENTITY THREAT scored 5/5 (>=3 = YES)",
      "IMMEDIATE SPEND scored 4/5 (>=3 = YES)"
    ]
  },
  "disposition": {
    "library_role": "MODULE",
    "rationale": "Report assigns: \"Module (multi-birth acceptance + targeted fixes) / Marketing angle\". Verdict: PASSES (20/25).",
    "assigned_at": "2026-08-19",
    "promoted_transformation_id": null,
    "reclassification_history": []
  },
  "status": "dispositioned",
  "related_opportunity_ids": []
}
