{
  "opportunity_id": "OPP-PPL-DCR-19",
  "source": "library-report:DIASTASIS CORE RECOVERY.md",
  "source_references": [
    "Product Pipeline/Postpartum Library/DIASTASIS CORE RECOVERY.md",
    "Product Pipeline/followup.md"
  ],
  "life_area": "m01",
  "focus_market": "DIASTASIS CORE RECOVERY",
  "submarket": "unassigned",
  "collected_at": "2026-08-19",
  "finding": {
    "headline": "\"The Event-Season Tummy  (owambe/church/naming ceremony)\"",
    "problem": "\"In 2 months I must look good in Gele and gown for my brother's wedding. My tummy pooch shows in everything fitted. Help before then.\"",
    "recurring_situation": "unassigned",
    "person": "Ronke, 30, has a naming ceremony + wedding + church convention in 8 weeks; wants her belly flat-ish in fitted gown.",
    "trigger": "",
    "failed_attempt": "",
    "emotional_stake": "",
    "desired_outcome": "",
    "evidence_quotes": [],
    "mechanism_hypotheses": [],
    "competition_notes": "See RESEARCH BASE section of source report."
  },
  "survival_pain_test": {
    "urgency": false,
    "embarrassment": false,
    "failed_attempts": false,
    "identity_threat": false,
    "immediate_spend": true,
    "signals_observed": [
      "IMMEDIATE SPEND scored 4/5 (>=3 = YES)"
    ]
  },
  "disposition": {
    "library_role": "STANDALONE_TRANSFORMATION",
    "rationale": "Report assigns: \"Standalone product (date-bound transformation)\". Verdict: PASSES.",
    "assigned_at": "2026-08-19",
    "promoted_transformation_id": null,
    "reclassification_history": []
  },
  "status": "dispositioned",
  "related_opportunity_ids": []
}
