{
  "opportunity_id": "OPP-PPL-NPA-N20",
  "source": "library-report:NEW-PARENT ADMINISTRATION MARKET.md",
  "source_references": [
    "Product Pipeline/Postpartum Library/NEW-PARENT ADMINISTRATION MARKET.md",
    "Product Pipeline/followup.md"
  ],
  "life_area": "m01",
  "focus_market": "NEW-PARENT ADMINISTRATION MARKET",
  "submarket": "unassigned",
  "collected_at": "2026-08-19",
  "finding": {
    "headline": "\"Cultural/Religious Myth-Busting: Register Later Trap\"",
    "problem": "\"My pastor's wife said don't worry, do it next month. But the nurse said 60 days. Who do I believe?\"",
    "recurring_situation": "unassigned",
    "person": "Church/mosque-community new mum told by aunty/pastor \"just register later\" — but the 60-day NPC window + vaccine schedule mean 'later' costs money.",
    "trigger": "",
    "failed_attempt": "",
    "emotional_stake": "",
    "desired_outcome": "",
    "evidence_quotes": [],
    "mechanism_hypotheses": [],
    "competition_notes": "See RESEARCH BASE section of source report."
  },
  "survival_pain_test": {
    "urgency": false,
    "embarrassment": false,
    "failed_attempts": false,
    "identity_threat": false,
    "immediate_spend": true,
    "signals_observed": [
      "IMMEDIATE SPEND scored 4/5 (>=3 = YES)"
    ]
  },
  "disposition": {
    "library_role": "MARKETING_ANGLE",
    "rationale": "Report assigns: \"Marketing angle / entry point (culturally-trusted urgency).\". Verdict: PASSES.",
    "assigned_at": "2026-08-19",
    "promoted_transformation_id": null,
    "reclassification_history": []
  },
  "status": "dispositioned",
  "related_opportunity_ids": []
}
