{
  "opportunity_id": "OPP-PPL-NPO-4",
  "source": "library-report:NEW PARENT OPERATING SYSTEM.md",
  "source_references": [
    "Product Pipeline/Postpartum Library/NEW PARENT OPERATING SYSTEM.md",
    "Product Pipeline/followup.md"
  ],
  "life_area": "m01",
  "focus_market": "NEW PARENT OPERATING SYSTEM",
  "submarket": "First-year household financial transition (N22)",
  "collected_at": "2026-08-19",
  "finding": {
    "headline": "\"LEVEL SEGMENTATION\"",
    "problem": "",
    "recurring_situation": "First-year household financial transition (N22)",
    "person": "",
    "trigger": "",
    "failed_attempt": "",
    "emotional_stake": "",
    "desired_outcome": "",
    "evidence_quotes": [],
    "mechanism_hypotheses": [],
    "competition_notes": "See RESEARCH BASE section of source report."
  },
  "survival_pain_test": {
    "urgency": false,
    "embarrassment": false,
    "failed_attempts": false,
    "identity_threat": false,
    "immediate_spend": false,
    "signals_observed": [
      "[BACKFILL] no machine-readable score in entry"
    ]
  },
  "disposition": {
    "library_role": "FUTURE_RESEARCH",
    "rationale": "[BACKFILL] no explicit role found in report - defaulted FUTURE_RESEARCH pending review.",
    "assigned_at": "2026-08-19",
    "promoted_transformation_id": null,
    "reclassification_history": []
  },
  "status": "dispositioned",
  "related_opportunity_ids": []
}
